Outlier Rating,Multiplier Ratio,Video Title,Channel Name,Subscribers,Views,Likes,Comments,Publish Date,YouTube URL
⭐ CRITICAL HIT (389.8x),389.83,how to make $600 a day with a faceless youtube channel (automation)...,Caden Coy,1150,448308,9469,213,2023-03-08,https://www.youtube.com/watch?v=YHGE5CoI7S8
⭐ CRITICAL HIT (119.4x),119.38,How I Make MONETIZABLE Faceless YouTube Story channel automation,GREAT WITH AI,23100,2757681,101130,1879,2024-09-23,https://www.youtube.com/watch?v=wLg8fkQ0wGg
🔥 VIRAL (37.1x),37.09,I tried Faceless YouTube Automation for 200 days,Darragh Lucey,24000,890255,21054,829,2023-10-07,https://www.youtube.com/watch?v=mJld3pDws_c
🔥 VIRAL (25.8x),25.78,Create faceless videos on auto-pilot with FacelessReels,AI Money Team Tips,2300,59291,0,31,2025-09-24,https://www.youtube.com/watch?v=BEiSN1gWnwM
🔥 VIRAL (16.2x),16.25,I Tried Faceless YouTube Automation for 30 Days Realistic Results,Stickman Matt,5020,81573,2359,135,2026-02-14,https://www.youtube.com/watch?v=2n2P-rpql34
